<window xmlns:xsi="http://www.w3.org/2001/XMLSchema-instance" xsi:noNamespaceSchemaLocation="block_ui.xsd" size="1600 900" type="FIXED_VANILLA" pause="true" lightbox="true">
    <button id="bt" label="vanilla" size="100 100" pos="0 0" textscale="5"/>
    <button id="bti" label="textured" size="100 100" pos="100 0" textscale="5" textoffset="18 18" textbox="64 64" source="blockui:button" cursor="blockui:textures/gui/test_cursor.png"/>
    <text id="txt" size="600 250" pos="0 100" textcolor="yellow" tooltip="test tooltip" textscale="3.5" textalign="BOTTOM_RIGHT" text="Lorem ipsum dolor sit amet, consectetur adipiscing elit. Ut eros elit, tempus quis imperdiet iaculis, dignissim ac velit. Donec sed molestie sem. Fusce lacinia est nec nibh lobortis aliquet. Aliquam lorem est, vehicula sodales lorem ac, mollis faucibus felis. Fusce facilisis suscipit mi. Fusce luctus erat et magna rutrum ullamcorper. Phasellus placerat, nulla in mattis mattis, purus nunc elementum nisl, ac tristique risus neque in dolor. Nunc a sagittis ligula. Sed ut placerat elit, a ultricies purus. Nullam vel gravida ante.\nProin mattis lobortis tellus sit amet semper. Integer ut viverra nunc. Donec dictum tincidunt laoreet. Pellentesque ultrices dapibus ex, ut iaculis odio. Ut suscipit, nibh eu condimentum gravida, sapien neque blandit ipsum, eget laoreet ipsum erat id felis. Fusce tempor dui sit amet bibendum tristique. Curabitur sodales, leo sit amet blandit rhoncus, arcu est gravida nibh, vitae fringilla sapien nunc vel nisl. Praesent a tristique tortor. Nullam facilisis nisi at augue condimentum ornare. Aliquam vitae sem ipsum. Quisque varius ut dolor at sagittis. Suspendisse vehicula mattis massa vitae hendrerit. Nunc blandit suscipit enim."/>
    <itemicon item="minecraft:birch_log" size="16 16" pos="0 570"/>
    <itemicon item="minecraft:bundle" nbt='{"minecraft:bundle_contents": [{count: 1, id: "minecraft:redstone"}, {count: 1, components: {"minecraft:potion_contents": {potion: "minecraft:long_turtle_master"}}, id: "minecraft:tipped_arrow"}, {count: 1, components: {"minecraft:potion_contents": {potion: "minecraft:turtle_master"}}, id: "minecraft:tipped_arrow"}, {count: 1, components: {"minecraft:potion_contents": {potion: "minecraft:strong_healing"}}, id: "minecraft:tipped_arrow"}, {count: 1, components: {"minecraft:potion_contents": {potion: "minecraft:strong_strength"}}, id: "minecraft:tipped_arrow"}, {count: 1, components: {"minecraft:potion_contents": {potion: "minecraft:long_weakness"}}, id: "minecraft:tipped_arrow"}, {count: 1, components: {"minecraft:fireworks": {flight_duration: 3b}}, id: "minecraft:firework_rocket"}, {count: 1, id: "minecraft:spectral_arrow"}, {count: 1, id: "minecraft:snowball"}, {count: 2, id: "minecraft:birch_stairs"}, {count: 1, id: "minecraft:birch_wood"}, {count: 1, id: "minecraft:birch_door"}, {count: 16, id: "minecraft:stripped_jungle_wood"}, {count: 8, id: "minecraft:egg"}]}' size="16 16" pos="16 570"/>
    <itemicon item="minecraft:netherite_upgrade_smithing_template" size="16 16" pos="32 570"/>
    <itemicon item="minecraft:lime_shulker_box" size="16 16" pos="48 570" nbt='{"minecraft:container": [{item: {count: 1, id: "minecraft:birch_stairs"}, slot: 0}]}'/>
    <input id="txtin" size="400 100" pos="0 600"/>
    <image id="vanilla_uv_test" pos="0 750" size="728 20" imageoffset="185 548" imagesize="182 5" source="minecraft:textures/atlas/gui.png"/>
    <image id="missing" pos="120 800" size="100 100" source="blockui:veryuglymissingtexture"/>
    <image id="missing_out_of_jar" pos="240 800" size="100 100" source="blockui:veryuglymissingtexture"/>
    <image id="working_out_of_jar" pos="360 800" size="100 100" source="blockui:veryuglymissingtexture"/>
    <image id="anim_test" pos="0 800" size="100 100" source="blockui:spritesheet_leaves"/>
    <button id="unicodeTest" cursor="blockui:missingcursortexture" size="50 50" label="↥" pos="600 270"  textscale="3.5"/>
    <zoomdragview id="zdv" pos="800 0" size="800 900">
        <scrollgroup pos="0 0" size="109 900" childspacing="10">
            <button size="100 100" label="0" textscale="10"/>
            <button size="100 100" label="1" textscale="10"/>
            <button size="100 100" label="2" textscale="10"/>
            <button size="100 100" label="3" textscale="10"/>
            <button size="100 100" label="4" textscale="10"/>
            <button size="100 100" label="5" textscale="10"/>
            <button size="100 100" label="6" textscale="10"/>
            <button size="100 100" label="7" textscale="10"/>
            <button size="100 100" label="8" textscale="10"/>
            <button size="100 100" label="9" textscale="10"/>
            <dropdown size="100 20">
                <image size="100 100" source="blockui:button"/>
            </dropdown>
            <button size="100 100" label="10" textscale="10"/>
            <button size="100 100" label="11" textscale="10"/>
            <button size="100 100" label="12" textscale="10"/>
            <button size="100 100" label="13" textscale="10"/>
            <button size="100 100" label="14" textscale="10"/>
            <button size="100 100" label="15" textscale="10"/>
            <button size="100 100" label="16" textscale="10"/>
            <button size="100 100" label="17" textscale="10"/>
        </scrollgroup>
        <dropdown size="100 20" pos="150 0">
            <image size="100 100" source="blockui:button"/>
        </dropdown>
        <itemicon id="ii" item="minecraft:barrier" onHoverId="ii2" size="16 16" pos="0 400"/>
        <itemicon id="ii2" item="minecraft:diamond_pickaxe" pos="0 416" size="16 16"/>
        <gradient pos="100 500" size="100 100" gradientstart="rgb(0,0,0)" gradientend="rgb(255,255,255)"/>
        <itemicon item="minecraft:oak_fence" nbt="{block_state:{south:'true',waterlogged:'true'}}" size="64 64" pos="300 50"/>
        <itemicon item="domum_ornamentum:plain" nbt="{block_state:{facing:'up'}, block_entity_data:{id:'domum_ornamentum:materially_retexturable',textureData:{'minecraft:block/oak_planks':'minecraft:polished_basalt','minecraft:block/dark_oak_planks':'minecraft:red_stained_glass'}}}" size="64 64" pos="370 50"/>
        <itemicon item="minecraft:oak_stairs" nbt="{block_state:{waterlogged:'true',facing:'south'}}" size="64 64" pos="440 50"/>
        <itemicon item="minecraft:oak_stairs" nbt="{block_state:{facing:'east'}}" size="64 64" pos="510 50"/>
        <itemicon item="minecraft:oak_stairs" size="64 64" pos="580 50"/>
        <itemicon item="minecraft:clock" properties="{_item:{time:0.5}}" size="32 32" pos="650 50"/>
        <itemicon item="minecraft:clock" size="32 32" pos="700 50"/>
        <image id="player_skin" pos="300 300" size="128 128" source="blockui:veryuglymissingtexture"/>
        <image id="player_cape" pos="428 300" size="128 64" source="blockui:veryuglymissingtexture"/>
        <image id="player_elytra" pos="556 300" size="128 128" source="blockui:veryuglymissingtexture"/>
        <image id="repeat_blit" pos="300 500" size="70 70" source="blockui:repeat_blit"/>
        <image id="repeat_blit_stretch" pos="400 500" size="70 70" source="blockui:repeat_blit_stretch"/>
    </zoomdragview>
</window>
