<window xmlns:xsi="http://www.w3.org/2001/XMLSchema-instance" xsi:noNamespaceSchemaLocation="block_ui.xsd" size="640 480" pause="true" lightbox="true">
    <list id="list1" size="160 240">
        <text size="152 20"/>
    </list>
    <list id="list2" size="160 240" pos="160 0">
        <text size="152 20"/>
    </list>
    <list id="list3" size="160 240" pos="320 0">
        <view size="152 20">
            <text size="100 20"/>
            <checkbox pos="120 3"
                size="14 15"
                id="checkbox"
                source="blockui:button_mini"
                disabled="blockui:button_mini_disabled"
                checkmark="blockui:overlay_mini_check"/>
        </view>
    </list>
    <list id="list4" size="160 200" pos="480 0" emptytext="This list is empty" emptyscale="0.8" emptycolor="white">
        <text size="152 20"/>
    </list>
    <button id="list4add" pos="480 200" size="160 20" label="Add item"/>
    <button id="list4remove" pos="480 220" size="160 20" label="Remove item"/>
    <list id="list5" size="160 200" pos="0 240" emptytext="This list is empty" emptyscale="0.8" emptycolor="white">
        <text size="152 20"/>
    </list>
    <button id="list5update" pos="0 440" size="160 20" label="Update list"/>
</window>
